nfm-smart v1
policy=direct targets=68
== /dev/sda dev=/dev/sda kind=direct ==
smartctl 7.5 2025-04-30 r5714 [x86_64-linux-7.0.14-19-pve] (local build)
Copyright (C) 2002-25, Bruce Allen, Christian Franke, www.smartmontools.org

=== START OF READ SMART DATA SECTION ===
SMART overall-health self-assessment test result: PASSED

SMART Attributes Data Structure revision number: 10
Vendor Specific SMART Attributes with Thresholds:
ID# ATTRIBUTE_NAME          FLAG     VALUE WORST THRESH TYPE      UPDATED  WHEN_FAILED RAW_VALUE
  1 Raw_Read_Error_Rate     0x010f   083   064   ---    Pre-fail  Always       -       205251144
  3 Spin_Up_Time            0x0103   092   092   ---    Pre-fail  Always       -       0
  4 Start_Stop_Count        0x0032   100   100   ---    Old_age   Always       -       41
  5 Reallocated_Sector_Ct   0x0133   100   100   ---    Pre-fail  Always       -       0
  7 Seek_Error_Rate         0x000f   091   060   ---    Pre-fail  Always       -       1130621315
  9 Power_On_Hours          0x0032   038   038   ---    Old_age   Always       -       54583
 10 Spin_Retry_Count        0x0013   100   100   ---    Pre-fail  Always       -       0
 12 Power_Cycle_Count       0x0032   100   100   ---    Old_age   Always       -       39
184 End-to-End_Error        0x0032   100   100   ---    Old_age   Always       -       0
187 Reported_Uncorrect      0x0032   100   100   ---    Old_age   Always       -       0
188 Command_Timeout         0x0032   100   100   ---    Old_age   Always       -       0
189 High_Fly_Writes         0x003a   100   100   ---    Old_age   Always       -       0
190 Airflow_Temperature_Cel 0x0022   074   057   ---    Old_age   Always       -       26 (Min/Max 24/31)
191 G-Sense_Error_Rate      0x0032   100   100   ---    Old_age   Always       -       448
192 Power-Off_Retract_Count 0x0032   092   092   ---    Old_age   Always       -       16596
193 Load_Cycle_Count        0x0032   085   085   ---    Old_age   Always       -       30403
194 Temperature_Celsius     0x0022   026   043   ---    Old_age   Always       -       26 (0 19 0 0 0)
195 Hardware_ECC_Recovered  0x001a   001   001   ---    Old_age   Always       -       205251144
196 Reallocated_Event_Count 0x0032   100   100   ---    Old_age   Always       -       0
197 Current_Pending_Sector  0x0012   100   100   ---    Old_age   Always       -       0
198 Offline_Uncorrectable   0x0010   100   100   ---    Old_age   Offline      -       0
199 UDMA_CRC_Error_Count    0x003e   200   200   ---    Old_age   Always       -       0
240 Head_Flying_Hours       0x0000   100   253   ---    Old_age   Offline      -       16477 (157 164 0)
241 Total_LBAs_Written      0x0000   100   253   ---    Old_age   Offline      -       14908424997
242 Total_LBAs_Read         0x0000   100   253   ---    Old_age   Offline      -       1224673498707
-- rc=0
== /dev/sde dev=/dev/sde kind=direct ==
smartctl 7.5 2025-04-30 r5714 [x86_64-linux-7.0.14-19-pve] (local build)
Copyright (C) 2002-25, Bruce Allen, Christian Franke, www.smartmontools.org

=== START OF READ SMART DATA SECTION ===
SMART Health Status: OK

Current Drive Temperature:     25 C
Drive Trip Temperature:        65 C

Accumulated power on time, hours:minutes 22738:46
Manufactured in week 51 of year 2020
Specified cycle count over device lifetime:  50000
Accumulated start-stop cycles:  38
Specified load-unload count over device lifetime:  600000
Accumulated load-unload cycles:  38
Elements in grown defect list: 0
-- rc=0
== /dev/sdw kind=virtual ==
nfm: no SMART (controller virtual drive; members are polled as megaraid PDs)
== /dev/sdbn dev=/dev/sdbn kind=direct ==
smartctl 7.5 2025-04-30 r5714 [x86_64-linux-7.0.14-19-pve] (local build)
Copyright (C) 2002-25, Bruce Allen, Christian Franke, www.smartmontools.org

=== START OF READ SMART DATA SECTION ===
SMART overall-health self-assessment test result: PASSED

SMART Attributes Data Structure revision number: 16
Vendor Specific SMART Attributes with Thresholds:
ID# ATTRIBUTE_NAME          FLAG     VALUE WORST THRESH TYPE      UPDATED  WHEN_FAILED RAW_VALUE
  1 Raw_Read_Error_Rate     0x002f   200   200   051    Pre-fail  Always       -       0
  3 Spin_Up_Time            0x0027   187   180   021    Pre-fail  Always       -       7625
  4 Start_Stop_Count        0x0032   058   058   000    Old_age   Always       -       42293
  5 Reallocated_Sector_Ct   0x0033   200   200   140    Pre-fail  Always       -       0
  7 Seek_Error_Rate         0x002e   200   200   000    Old_age   Always       -       0
  9 Power_On_Hours          0x0032   010   009   000    Old_age   Always       -       65917
 10 Spin_Retry_Count        0x0032   100   100   000    Old_age   Always       -       0
 11 Calibration_Retry_Count 0x0032   100   253   000    Old_age   Always       -       0
 12 Power_Cycle_Count       0x0032   100   100   000    Old_age   Always       -       15
192 Power-Off_Retract_Count 0x0032   200   200   000    Old_age   Always       -       9
193 Load_Cycle_Count        0x0032   185   185   000    Old_age   Always       -       46902
194 Temperature_Celsius     0x0022   123   108   000    Old_age   Always       -       29
196 Reallocated_Event_Count 0x0032   200   200   000    Old_age   Always       -       0
197 Current_Pending_Sector  0x0032   200   200   000    Old_age   Always       -       0
198 Offline_Uncorrectable   0x0030   100   253   000    Old_age   Offline      -       0
199 UDMA_CRC_Error_Count    0x0032   200   200   000    Old_age   Always       -       0
200 Multi_Zone_Error_Rate   0x0008   100   253   000    Old_age   Offline      -       0
-- rc=0
== /dev/bus/0:megaraid,28 dev=/dev/bus/0 type=megaraid,28 kind=megaraid-hidden ==
smartctl 7.5 2025-04-30 r5714 [x86_64-linux-7.0.14-19-pve] (local build)
Copyright (C) 2002-25, Bruce Allen, Christian Franke, www.smartmontools.org

=== START OF READ SMART DATA SECTION ===
SMART Health Status: OK

Percentage used endurance indicator: 2%
Current Drive Temperature:     24 C
Drive Trip Temperature:        60 C

Accumulated power on time, hours:minutes 17241:16
Manufactured in week 37 of year 2015
Specified cycle count over device lifetime:  10000
Accumulated start-stop cycles:  88
Elements in grown defect list: 0
-- rc=0
end=1
